{
  "schema": "icecream-distribution-scenario-v1",
  "name": "firefox-10c-50f-60cores-5builds-10min",
  "seed": 12345,
  "environments": {
    "env_count": 10,
    "job_selection": {
      "mode": "explicit",
      "jobs": [
        {
          "id": "firefox-c0",
          "environment": 0,
          "trace": "../firefox-corrected.compile-trace.tsv",
          "corpus_root": "/tanksmall/scratch/ictmp/corpus18",
          "builds": 5,
          "start_ns": 0,
          "build_release": { "mode": "after-previous", "gap_ns": 600000000000 },
          "tu_release": { "mode": "all-at-zero" }
        },
        {
          "id": "firefox-c1",
          "environment": 1,
          "trace": "../firefox-corrected.compile-trace.tsv",
          "corpus_root": "/tanksmall/scratch/ictmp/corpus18",
          "builds": 5,
          "start_ns": 0,
          "build_release": { "mode": "after-previous", "gap_ns": 600000000000 },
          "tu_release": { "mode": "all-at-zero" }
        },
        {
          "id": "firefox-c2",
          "environment": 2,
          "trace": "../firefox-corrected.compile-trace.tsv",
          "corpus_root": "/tanksmall/scratch/ictmp/corpus18",
          "builds": 5,
          "start_ns": 0,
          "build_release": { "mode": "after-previous", "gap_ns": 600000000000 },
          "tu_release": { "mode": "all-at-zero" }
        },
        {
          "id": "firefox-c3",
          "environment": 3,
          "trace": "../firefox-corrected.compile-trace.tsv",
          "corpus_root": "/tanksmall/scratch/ictmp/corpus18",
          "builds": 5,
          "start_ns": 0,
          "build_release": { "mode": "after-previous", "gap_ns": 600000000000 },
          "tu_release": { "mode": "all-at-zero" }
        },
        {
          "id": "firefox-c4",
          "environment": 4,
          "trace": "../firefox-corrected.compile-trace.tsv",
          "corpus_root": "/tanksmall/scratch/ictmp/corpus18",
          "builds": 5,
          "start_ns": 0,
          "build_release": { "mode": "after-previous", "gap_ns": 600000000000 },
          "tu_release": { "mode": "all-at-zero" }
        },
        {
          "id": "firefox-c5",
          "environment": 5,
          "trace": "../firefox-corrected.compile-trace.tsv",
          "corpus_root": "/tanksmall/scratch/ictmp/corpus18",
          "builds": 5,
          "start_ns": 0,
          "build_release": { "mode": "after-previous", "gap_ns": 600000000000 },
          "tu_release": { "mode": "all-at-zero" }
        },
        {
          "id": "firefox-c6",
          "environment": 6,
          "trace": "../firefox-corrected.compile-trace.tsv",
          "corpus_root": "/tanksmall/scratch/ictmp/corpus18",
          "builds": 5,
          "start_ns": 0,
          "build_release": { "mode": "after-previous", "gap_ns": 600000000000 },
          "tu_release": { "mode": "all-at-zero" }
        },
        {
          "id": "firefox-c7",
          "environment": 7,
          "trace": "../firefox-corrected.compile-trace.tsv",
          "corpus_root": "/tanksmall/scratch/ictmp/corpus18",
          "builds": 5,
          "start_ns": 0,
          "build_release": { "mode": "after-previous", "gap_ns": 600000000000 },
          "tu_release": { "mode": "all-at-zero" }
        },
        {
          "id": "firefox-c8",
          "environment": 8,
          "trace": "../firefox-corrected.compile-trace.tsv",
          "corpus_root": "/tanksmall/scratch/ictmp/corpus18",
          "builds": 5,
          "start_ns": 0,
          "build_release": { "mode": "after-previous", "gap_ns": 600000000000 },
          "tu_release": { "mode": "all-at-zero" }
        },
        {
          "id": "firefox-c9",
          "environment": 9,
          "trace": "../firefox-corrected.compile-trace.tsv",
          "corpus_root": "/tanksmall/scratch/ictmp/corpus18",
          "builds": 5,
          "start_ns": 0,
          "build_release": { "mode": "after-previous", "gap_ns": 600000000000 },
          "tu_release": { "mode": "all-at-zero" }
        }
      ]
    }
  },
  "workers": {
    "f_count": 50,
    "template": {
      "slots": 60,
      "compile_profile": "firefox-compile-v1-size-linear",
      "initial_cache": "cold"
    }
  },
  "network": {
    "c_to_f": {
      "bits_per_second": 1000000000,
      "one_way_latency_ns": 250000,
      "lanes_per_endpoint": 1
    },
    "f_to_c": {
      "bits_per_second": 1000000000,
      "one_way_latency_ns": 250000,
      "lanes_per_endpoint": 1
    },
    "shared_fabric_bps": 10000000000
  },
  "scheduler": {
    "ready_job_policy": "environment-round-robin",
    "placement_policy": "round-robin"
  },
  "experiment": {
    "codecs": ["grz", "p29"],
    "routing_mode": "online"
  }
}
