{
  "schema": "icecream-distribution-scenario-v1",
  "name": "firefox-corrected-1c-20f",
  "seed": 12345,
  "environments": {
    "env_count": 1,
    "job_selection": {
      "mode": "explicit",
      "jobs": [
        {
          "id": "firefox-corrected",
          "environment": 0,
          "trace": "firefox-corrected.compile-trace.tsv",
          "corpus_root": "/tanksmall/scratch/ictmp/corpus18",
          "builds": 1,
          "start_ns": 0,
          "build_release": { "mode": "after-previous" },
          "tu_release": { "mode": "all-at-zero" }
        }
      ]
    }
  },
  "workers": {
    "f_count": 20,
    "template": {
      "slots": 1,
      "compile_profile": "firefox-compile-v1-size-linear",
      "initial_cache": "cold"
    }
  },
  "network": {
    "c_to_f": {
      "bits_per_second": 1000000000,
      "one_way_latency_ns": 250000,
      "lanes_per_endpoint": 1
    },
    "f_to_c": {
      "bits_per_second": 1000000000,
      "one_way_latency_ns": 250000,
      "lanes_per_endpoint": 1
    },
    "shared_fabric_bps": 10000000000
  },
  "scheduler": {
    "ready_job_policy": "fifo-release",
    "placement_policy": "round-robin"
  },
  "experiment": {
    "codecs": ["grz", "p29"],
    "routing_mode": "online"
  }
}
